{
  "chunk": "ch03",
  "chapter": 3,
  "dataVersion": "2.0",
  "lessons": [
    {
      "objective": "AI-3.1.1",
      "syllabusVersion": "2.0",
      "syllabusRef": "§3.1.1",
      "revision": 1,
      "status": "published",
      "origin": "original",
      "i18n": {
        "tr": {
          "title": "Makine öğreniminin biçimleri",
          "paragraphs": [
            "Makine öğrenimi (MÖ) algoritmaları üç ana biçime ayrılır: denetimli öğrenme, denetimsiz öğrenme ve takviyeli öğrenme. Biçimi belirleyen şey algoritmanın adı değil, modelin neyden öğrendiğidir: etiketli veriden, etiketsiz veriden ya da ortamıyla etkileşimden.",
            "Denetimli öğrenmede her girdi kümesinin karşılığında bir çıktı etiketi vardır ve model girdiyle çıktı arasındaki eşlemeyi öğrenir. Çıktı önceden tanımlı sınıflardan biriyse bu sınıflandırmadır (e-postanın istenmeyen posta olup olmadığı). Çıktı sürekli bir sayısal değerse bu MÖ regresyonudur (yaşam tarzı verisinden yaş tahmini). Denetimsiz öğrenmede etiket yoktur; model benzer girdileri ortak özniteliklere göre gruplar. Benzerliğe göre gruplama kümelemedir (müşteri kesimleri), veri nitelikleri arasındaki ilişkileri bulmak ilişkilendirmedir (satın alma örüntülerinden ürün önerisi).",
            "Takviyeli öğrenmede yapay zekâ tabanlı sistem (akıllı ajan) bir veri setinden değil, ortamıyla etkileşerek öğrenir: eylemlerinin sonucuna göre ödül ya da ceza alır. Burada zorluklar ortamı kurmak, ödül fonksiyonunu tasarlamak ve hedefe götüren en iyi stratejiyi seçmektir. Verilen bir senaryoda biçimi ayırt etmek için şunu sorun: veri etiketli mi, etiketsiz mi, yoksa hiç veri seti yok da ortamında eylemde bulunan bir ajan mı var?"
          ],
          "keyPoints": [
            "Denetimli öğrenme etiketli veriyle çalışır ve sınıflandırma ile MÖ regresyonuna ayrılır.",
            "Sınıflandırma çıktıyı önceden tanımlı sınıflara atar; MÖ regresyonu sürekli sayısal değer tahmin eder.",
            "Denetimsiz öğrenme etiketsiz veriyle çalışır ve kümeleme ile ilişkilendirmeye ayrılır.",
            "Takviyeli öğrenmede ajan ortamıyla etkileşir ve ödül ya da ceza ile bir veri setinden değil deneyimden öğrenir.",
            "Takviyeli öğrenmenin zorlukları ortamı kurmak, ödül fonksiyonunu tasarlamak ve en iyi stratejiyi seçmektir."
          ],
          "commonMistakes": [
            "MÖ regresyonu, ISTQB'nin diğer müfredatlarındaki regresyon testiyle karıştırılır. MÖ bağlamında regresyon, sürekli sayısal değer tahmin etmektir; diğer müfredatlardaki regresyon ise yazılım değişikliklerinin değişimle ilgili hatalara yol açması sorunudur.",
            "Sayı tahmin eden her problemin denetimsiz olduğu sanılır. Sayısal bir etiketi öğrenmek denetimli öğrenmedir; denetimsiz öğrenmeyi belirleyen etiketin hiç bulunmamasıdır.",
            "Takviyeli öğrenmede de bir eğitim veri setinin bulunduğu varsayılır. Ajan deneyimden öğrenir ve geri bildirim olarak ödül ya da ceza alır."
          ]
        },
        "en": {
          "title": "The forms of machine learning",
          "paragraphs": [
            "Machine learning (ML) algorithms fall into three forms: supervised, unsupervised and reinforcement learning. What decides the form is not the name of the algorithm but what the model learns from: labeled data, unlabeled data, or interaction with an environment.",
            "In supervised learning every set of inputs has a corresponding output label and the model learns the mapping from inputs to outputs. If the output is one of a set of predefined classes, the task is classification (is this email spam or not). If the output is a continuous numerical value, the task is ML regression (estimating age from lifestyle data). In unsupervised learning there are no labels and the model groups similar inputs by shared features. Grouping by similarity is clustering (customer segments); finding relationships among data attributes is association (recommending products from purchasing patterns).",
            "In reinforcement learning the AI-based system (an intelligent agent) learns not from a dataset but by interacting with its environment, receiving rewards or penalties for the outcome of its actions. The difficulties here are setting up the environment, designing the reward function and selecting the best strategy for the goal. To tell the forms apart in a given scenario, ask: is the data labeled, is it unlabeled, or is there no dataset at all but an agent acting in an environment?"
          ],
          "keyPoints": [
            "Supervised learning works with labeled data and divides into classification and ML regression.",
            "Classification assigns inputs to predefined classes; ML regression predicts a continuous numerical value.",
            "Unsupervised learning works with unlabeled data and divides into clustering and association.",
            "In reinforcement learning an agent interacts with its environment and learns from rewards or penalties, from experience rather than from a dataset.",
            "The challenges of reinforcement learning are setting up the environment, designing the reward function and selecting the best strategy."
          ],
          "commonMistakes": [
            "ML regression is confused with regression testing as used in other ISTQB syllabi. In ML, regression means predicting a continuous numerical value; in other syllabi it is the problem of software modifications causing change-related defects.",
            "Any problem that predicts a number is taken to be unsupervised. Learning a numerical label is supervised learning; what makes learning unsupervised is that no label exists at all.",
            "Reinforcement learning is assumed to have a training dataset too. The agent learns from experience, receiving rewards or penalties as feedback."
          ]
        }
      },
      "meta": {
        "author": "lesson-writer",
        "reviewedBy": "lesson-review (2 adversarial passes, 2026-10-02; CT-AI v2.0 F4-01 — claims checked against the v2.0 syllabus, exam meta-claims removed, worked examples recomputed)",
        "createdAt": "2026-10-02",
        "updatedAt": "2026-10-02"
      }
    },
    {
      "objective": "AI-3.1.2",
      "syllabusVersion": "2.0",
      "syllabusRef": "§3.1.2",
      "revision": 1,
      "status": "published",
      "origin": "original",
      "i18n": {
        "tr": {
          "title": "MÖ iş akışı",
          "paragraphs": [
            "MÖ iş akışı, bir MÖ sisteminin hedeflerin anlaşılmasından izlemeye kadar geçtiği etkinliklerin mantıksal dizisidir: hedefleri anlama, çerçeve seçme, algoritmayı seçme ve oluşturma, veriyi hazırlama ve test etme, modeli eğitme, değerlendirme, ayarlama, test etme, dağıtım, kullanma, izleme ve ayarlama. Pratikte bu dizi bir kez izlenip bırakılmaz; adımlar yinelemeli olarak tekrarlanır.",
            "Temel ayrım model üretimi ile model testi arasındadır. Eğitme, değerlendirme ve ayarlama birlikte model üretimini oluşturur. Eğitimde seçilen algoritma eğitim verisiyle modeli eğitir; model yapısını belirleyen parametreler (ör. katman sayısı) model hiperparametreleri, eğitimi yöneten parametreler (ör. yineleme sayısı) algoritma hiperparametreleridir. Değerlendirmede model, kararlaştırılan MÖ fonksiyonel performans metriklerine göre doğrulama veri setiyle ölçülür; ayarlamada bu sonuçlarla hiperparametreler düzeltilir ve model yeniden eğitilir. Kabul edilebilir bir model çıktığında ise bağımsız bir test veri setiyle test edilir. Test sonuçları değerlendirme sonuçlarıyla karşılaştırılır; belirgin biçimde düşükse model üretimine, hatta veri hazırlığına geri dönmek gerekebilir.",
            "Akış dağıtımla bitmez. Dağıtılan model genellikle dağıtım için yeniden mühendislikten geçirilir ve kabul kriterlerini hâlâ karşılayıp karşılamadığı açısından test edilir. Kullanım sırasında model amaçlanan performanstan sapabilir (kayma); bu yüzden işletimdeki model düzenli olarak kabul kriterlerine göre değerlendirilir ve gerekirse yeni verilerle, yeni hiperparametrelerle ya da her ikisiyle yeniden eğitilir. Model çoğu zaman MÖ olmayan bileşenlerle entegre edilmek zorunda olduğundan entegrasyon, sistem ve kabul test seviyeleri de gerekebilir."
          ],
          "keyPoints": [
            "Eğitme, değerlendirme ve ayarlama birlikte model üretimini oluşturur.",
            "Değerlendirme doğrulama veri setini kullanır ve sonuçları ayarlamaya girdi olur; model testi ise bağımsız bir test veri setini kullanır.",
            "Model hiperparametreleri model yapısını, algoritma hiperparametreleri eğitimi belirler.",
            "Test sonuçları değerlendirme sonuçlarından belirgin biçimde düşükse model üretimine ya da veri hazırlığına dönmek gerekebilir.",
            "Dağıtılan model kabul kriterlerine karşı yeniden test edilir; işletimde kayma izlenir ve gerekirse model yeniden eğitilir.",
            "İş akışı mantıksal bir dizidir; uygulamada yinelemeli olarak tekrarlanır."
          ],
          "commonMistakes": [
            "Değerlendirme ile test aynı şey sanılır. Değerlendirme doğrulama veri setiyle yapılır ve ayarlamayı besler; test, ayarlanmış model üzerinde bağımsız test veri setiyle yapılır ve kararlaştırılan MÖ fonksiyonel performans kriterlerinin karşılandığını doğrular.",
            "Model dağıtıldığında işin bittiği varsayılır. Dağıtılan model yeniden test edilir ve işletim boyunca kabul kriterlerine göre izlenir, çünkü model beklenen performanstan sapabilir.",
            "Akışın tek yönlü olduğu düşünülür. Şekildeki sıra mantıksaldır; adımlar yinelemeli olarak tekrarlanır ve test sonuçları önceki adımlara dönmeyi gerektirebilir."
          ]
        },
        "en": {
          "title": "The ML workflow",
          "paragraphs": [